<?xml version="1.0" encoding="UTF-8" standalone="no" ?>
<Measurement xmlns:xsi="http://www.w3.org/2001/XMLSchema-instance" xsi:noNamespaceSchemaLocation="C:\Users\e14user\Documents\LabVIEW software\GitRepo\lib\Config\validator.xsd">
	<Loop>
		<Duration>00:30:00</Duration>
		<Image>
			<Prefix>img</Prefix>
			<AcquisitionInterval>00:03:00</AcquisitionInterval>
			<SaveDir>C:\Users\e14user\Documents\LabVIEW software\GitRepo\Config_Files</SaveDir>
		</Image>
		<Microscope>
			<Objective>20</Objective>
			<Filter>BF</Filter>
			<Prism>Side</Prism>
			<Intensity>13.3</Intensity>
			<Exposure>50</Exposure>
		</Microscope>
		<Microscope>
			<Objective>20</Objective>
			<Filter>GFP</Filter>
			<Prism>Side</Prism>
			<Intensity>40.0</Intensity>
			<Exposure>300</Exposure>
		</Microscope>
		<Position>
			<X>-527.4</X>
			<Y>-44.0</Y>
			<Focus>435.33</Focus>
		</Position>
		<Position>
			<X>-927.4</X>
			<Y>-44.0</Y>
			<Focus>435.33</Focus>
		</Position>
		<Position>
			<X>-1327.4</X>
			<Y>-44.0</Y>
			<Focus>435.33</Focus>
		</Position>
		<Position>
			<X>-1327.4</X>
			<Y>756.0</Y>
			<Focus>435.33</Focus>
		</Position>
		<Position>
			<X>-2727.4</X>
			<Y>456.0</Y>
			<Focus>439.58</Focus>
		</Position>
		<Position>
			<X>-2727.4</X>
			<Y>456.0</Y>
			<Focus>433.24</Focus>
		</Position>
		<Program>
			<Feed>
				<Ratio>33</Ratio>
			</Feed>
			<ChangeReagent>
				<Duration>00:00:05</Duration>
				<ReagentNr>3</ReagentNr>
			</ChangeReagent>
			<Pump>
				<Duration>00:00:10</Duration>
				<Frequency>7</Frequency>
			</Pump>
			<IterationStart>
				<ID>0</ID>
				<Iterations>20</Iterations>
			</IterationStart>
			<Pump>
				<Duration>00:00:10</Duration>
				<Frequency>8</Frequency>
			</Pump>
			<Incubate>00:00:20</Incubate>
			<Acquire />
			<Feed>
				<Ratio>10</Ratio>
			</Feed>
			<IterationEnd>0</IterationEnd>
		</Program>
	</Loop>
</Measurement>