<?xml version="1.0" encoding="UTF-8" standalone="no" ?>
<Measurement xmlns:xsi="http://www.w3.org/2001/XMLSchema-instance" xsi:noNamespaceSchemaLocation="C:\Users\e14user\Documents\LabVIEW software\GitRepo\lib\Config\validator.xsd"><Loop>
<Duration>00:30:00</Duration>
<Image>
<Prefix>zlast_test_img.tif</Prefix>
<AcquisitionInterval>00:01:00</AcquisitionInterval>
<SaveDir>C:\Users\e14user\Documents\LabVIEW software\GitRepo\Config_Files\TestFolder</SaveDir>
</Image>
<Microscope>
<Objective>20</Objective>
<Filter>BF</Filter>
<Prism>Side</Prism>
<Intensity>10.0</Intensity>
<Exposure>50</Exposure>
</Microscope>
<Microscope>
<Objective>20</Objective>
<Filter>GFP</Filter>
<Prism>Side</Prism>
<Intensity>50.0</Intensity>
<Exposure>500</Exposure>
</Microscope>
<Position>
<X>610.8</X>
<Y>0.0</Y>
<Focus>434.86</Focus>
</Position>
<Position>
<X>2236.9</X>
<Y>-482.1</Y>
<Focus>434.86</Focus>
</Position>
<Position>
<X>2236.9</X>
<Y>682.3</Y>
<Focus>434.86</Focus>
</Position>
<Program>
<IterationStart>
<ID>0</ID>
<Iterations>3</Iterations>
</IterationStart>
<Pump>
<Duration>00:00:15</Duration>
<Frequency>8</Frequency>
</Pump>
<Feed>
<Ratio>10</Ratio>
</Feed>
<Incubate>00:00:20</Incubate>
<ChangeReagent>
<Duration>00:00:05</Duration>
<ReagentNr>1</ReagentNr>
</ChangeReagent>
<Acquire />
<IterationEnd>0</IterationEnd>
</Program>
</Loop>
</Measurement>