<?xml version="1.0" encoding="UTF-8" standalone="no" ?>
<Measurement xmlns:xsi="http://www.w3.org/2001/XMLSchema-instance" xsi:noNamespaceSchemaLocation="C:\Users\e14user\Documents\LabVIEW software\GitRepo\lib\Config\validator.xsd"><Loop>
<Duration>00:10:00</Duration>
<Image>
<Prefix />
<AcquisitionInterval>00:01:30</AcquisitionInterval>
<SaveDir>C:\Users\e14user\Documents\LabVIEW software\GitRepo\Test_N_Eval_Images\200303_AcquTest</SaveDir>
</Image>
<Microscope>
<Objective>4</Objective>
<Filter>GFP</Filter>
<Prism>Side</Prism>
<Intensity>20.0</Intensity>
<Exposure>200</Exposure>
</Microscope>
<Microscope>
<Objective>4</Objective>
<Filter>BF</Filter>
<Prism>Side</Prism>
<Intensity>12.5</Intensity>
<Exposure>50</Exposure>
</Microscope>
<Position>
<X>-170.100</X>
<Y>-31787.700</Y>
<Focus>407.59</Focus>
</Position>
<Position>
<X>-170.100</X>
<Y>-35084.900</Y>
<Focus>407.59</Focus>
</Position>
<Position>
<X>-170.100</X>
<Y>-39462.300</Y>
<Focus>407.59</Focus>
</Position>
<Program>
<IterationStart>
<ID>0</ID>
<Iterations>5</Iterations>
</IterationStart>
<Acquire />
<Incubate>00:00:30</Incubate>
<IterationEnd>0</IterationEnd>
</Program>
</Loop>
</Measurement>