<?xml version="1.0" encoding="UTF-8" standalone="no" ?>
<Measurement xmlns:xsi="http://www.w3.org/2001/XMLSchema-instance" xsi:noNamespaceSchemaLocation="C:\Users\e14user\Documents\LabVIEW software\GitRepo\lib\Config\validator.xsd"><Loop>
<Duration>23:59:00</Duration>
<Image>
<Prefix>pR_mS</Prefix>
<AcquisitionInterval>00:15:00</AcquisitionInterval>
<SaveDir>C:\Users\e14user\data\jbrenner\200310_pRmS_run2</SaveDir>
</Image>
<Microscope>
<Objective>4</Objective>
<Filter>BF</Filter>
<Prism>Side</Prism>
<Intensity>12.5</Intensity>
<Exposure>300</Exposure>
</Microscope>
<Microscope>
<Objective>4</Objective>
<Filter>Cy5</Filter>
<Prism>Side</Prism>
<Intensity>20.0</Intensity>
<Exposure>500</Exposure>
</Microscope>
<Microscope>
<Objective>4</Objective>
<Filter>CFP</Filter>
<Prism>Side</Prism>
<Intensity>20.0</Intensity>
<Exposure>500</Exposure>
</Microscope>
<Microscope>
<Objective>4</Objective>
<Filter>YFP</Filter>
<Prism>Side</Prism>
<Intensity>20.0</Intensity>
<Exposure>500</Exposure>
</Microscope>
<Microscope>
<Objective>4</Objective>
<Filter>RFP</Filter>
<Prism>Side</Prism>
<Intensity>50.0</Intensity>
<Exposure>500</Exposure>
</Microscope>
<Position>
<X>980.400</X>
<Y>13331.500</Y>
<Focus>415.30</Focus>
</Position>
<Position>
<X>980.400</X>
<Y>11453.500</Y>
<Focus>415.30</Focus>
</Position>
<Position>
<X>980.400</X>
<Y>9582.800</Y>
<Focus>415.30</Focus>
</Position>
<Position>
<X>980.400</X>
<Y>7895.900</Y>
<Focus>415.30</Focus>
</Position>
<Position>
<X>980.400</X>
<Y>5771.000</Y>
<Focus>415.30</Focus>
</Position>
<Position>
<X>378.600</X>
<Y>4057.900</Y>
<Focus>415.30</Focus>
</Position>
<Position>
<X>378.600</X>
<Y>1920.600</Y>
<Focus>415.30</Focus>
</Position>
<Position>
<X>378.600</X>
<Y>-73.800</Y>
<Focus>415.30</Focus>
</Position>
<Program>
<IterationStart>
<ID>0</ID>
<Iterations>100</Iterations>
</IterationStart>
<ChangeReagent>
<Duration>00:00:05</Duration>
<ReagentNr>5</ReagentNr>
</ChangeReagent>
<Feed>
<Ratio>15</Ratio>
<Ring>1</Ring>
</Feed>
<Feed>
<Ratio>18.750000</Ratio>
<Ring>2</Ring>
</Feed>
<Feed>
<Ratio>22.5000</Ratio>
<Ring>3</Ring>
</Feed>
<Feed>
<Ratio>26.250000</Ratio>
<Ring>4</Ring>
</Feed>
<Feed>
<Ratio>30.000000</Ratio>
<Ring>5</Ring>
</Feed>
<Feed>
<Ratio>33.750000</Ratio>
<Ring>6</Ring>
</Feed>
<Feed>
<Ratio>37.500000</Ratio>
<Ring>7</Ring>
</Feed>
<Feed>
<Ratio>22.500000</Ratio>
<Ring>8</Ring>
</Feed>
<Incubate>00:00:10</Incubate>
<Acquire />
<ChangeReagent>
<Duration>00:00:05</Duration>
<ReagentNr>4</ReagentNr>
</ChangeReagent>
<Feed>
<Ratio>5.000000</Ratio>
<Ring>1</Ring>
</Feed>
<Feed>
<Ratio>6.250000</Ratio>
<Ring>2</Ring>
</Feed>
<Feed>
<Ratio>7.500000</Ratio>
<Ring>3</Ring>
</Feed>
<Feed>
<Ratio>8.750000</Ratio>
<Ring>4</Ring>
</Feed>
<Feed>
<Ratio>10.000000</Ratio>
<Ring>5</Ring>
</Feed>
<Feed>
<Ratio>11.250000</Ratio>
<Ring>6</Ring>
</Feed>
<Feed>
<Ratio>12.500000</Ratio>
<Ring>7</Ring>
</Feed>
<ChangeReagent>
<Duration>00:00:05</Duration>
<ReagentNr>6</ReagentNr>
</ChangeReagent>
<Feed>
<Ratio>7.500000</Ratio>
<Ring>8</Ring>
</Feed>
<Incubate>00:00:10</Incubate>
<Acquire />
<Pump>00:04:10</Pump>
<Incubate>00:00:10</Incubate>
<Acquire />
<IterationEnd>0</IterationEnd>
</Program>
</Loop>
</Measurement>