<?xml version="1.0" encoding="UTF-8" standalone="no" ?>
<Measurement xmlns:xsi="http://www.w3.org/2001/XMLSchema-instance" xsi:noNamespaceSchemaLocation="C:\Users\Familie\Documents\LabviewIX81\lib\Config\validator.xsd">
<Loop>
<Duration>01:26:00</Duration>
<Image>
<Prefix>rur</Prefix>
<AcquisitionInterval>00:07:33</AcquisitionInterval>
<SaveDir>C:\Users\Familie\Documents\LabviewIX81\Config_Files</SaveDir>
</Image>
<Microscope>
<Objective>20</Objective>
<Filter>BF</Filter>
<Prism>Side</Prism>
<Intensity>9.5</Intensity>
<Exposure>50</Exposure>
</Microscope>
<Microscope>
<Objective>20</Objective>
<Filter>GFP</Filter>
<Prism>Side</Prism>
<Intensity>2.5</Intensity>
<Exposure>150</Exposure>
</Microscope>
<Position>
<X>60415.1</X>
<Y>40337.1</Y>
<Focus>419.78</Focus>
</Position>
<Position>
<X>57455.3</X>
<Y>43292.3</Y>
<Focus>419.78</Focus>
</Position>
<Position>
<X>57455.3</X>
<Y>43292.3</Y>
<Focus>408.78</Focus>
</Position>
<Program>
<IterationStart>
<ID>0</ID>
<Iterations>1</Iterations>
</IterationStart>
<ChangeReagent>
<Duration>00:08:50</Duration>
<ReagentNr>3</ReagentNr>
</ChangeReagent>
<Feed>
<Ratio>0.000000</Ratio>
<Ring>5</Ring>
</Feed>
<IterationEnd>0</IterationEnd>
</Program>
</Loop>
</Measurement>