<?xml version="1.0" encoding="UTF-8" standalone="no" ?>
<Measurement xmlns:xsi="http://www.w3.org/2001/XMLSchema-instance" xsi:noNamespaceSchemaLocation="C:\Users\e14user\Documents\LabVIEW software\LabViewDevelopment\lib\Config\validator.xsd">
<Loop>
<Duration>00:34:00</Duration>
<Image>
<Prefix>2345</Prefix>
<AcquisitionInterval>00:03:54</AcquisitionInterval>
<SaveDir>C:\Users\e14user\Documents\LabVIEW software</SaveDir>
</Image>
<Program>
<ChangeReagent>
<Duration>00:00:10</Duration>
<ReagentNr>2</ReagentNr>
</ChangeReagent>
<Feed>
<Ratio>25.000000</Ratio>
<Ring>2</Ring>
</Feed>
<ChangeReagent>
<Duration>00:00:10</Duration>
<ReagentNr>3</ReagentNr>
</ChangeReagent>
<Feed>
<Ratio>25.000000</Ratio>
<Ring>7</Ring>
</Feed>
<IterationStart>
<ID>1</ID>
<Iterations>200</Iterations>
</IterationStart>
<ChangeReagent>
<Duration>00:00:30</Duration>
<ReagentNr>4</ReagentNr>
</ChangeReagent>
<Feed>
<Ratio>15.000000</Ratio>
<Ring>1</Ring>
</Feed>
<Feed>
<Ratio>15.000000</Ratio>
<Ring>8</Ring>
</Feed>
<Feed>
<Ratio>15.000000</Ratio>
<Ring>3</Ring>
</Feed>
<Feed>
<Ratio>15.000000</Ratio>
<Ring>4</Ring>
</Feed>
<Feed>
<Ratio>15.000000</Ratio>
<Ring>5</Ring>
</Feed>
<Feed>
<Ratio>15.000000</Ratio>
<Ring>6</Ring>
</Feed>
<Incubate>00:00:10</Incubate>
<Acquire />
<ChangeReagent>
<Duration>00:00:10</Duration>
<ReagentNr>1</ReagentNr>
</ChangeReagent>
<Feed>
<Ratio>5.000000</Ratio>
<Ring>8</Ring>
</Feed>
<Feed>
<Ratio>5.000000</Ratio>
<Ring>1</Ring>
</Feed>
<ChangeReagent>
<Duration>00:00:10</Duration>
<ReagentNr>2</ReagentNr>
</ChangeReagent>
<Feed>
<Ratio>5.000000</Ratio>
<Ring>3</Ring>
</Feed>
<Feed>
<Ratio>5.000000</Ratio>
<Ring>4</Ring>
</Feed>
<ChangeReagent>
<Duration>00:00:10</Duration>
<ReagentNr>3</ReagentNr>
</ChangeReagent>
<Feed>
<Ratio>5.000000</Ratio>
<Ring>5</Ring>
</Feed>
<Feed>
<Ratio>5.000000</Ratio>
<Ring>6</Ring>
</Feed>
<Incubate>00:00:10</Incubate>
<Acquire />
<Mix>00:04:10</Mix>
<Incubate>00:00:10</Incubate>
<Acquire />
<IterationEnd>1</IterationEnd>
</Program>
</Loop>
</Measurement>