<?xml version="1.0" encoding="UTF-8" standalone="no" ?>
<Measurement xmlns:xsi="http://www.w3.org/2001/XMLSchema-instance" xsi:noNamespaceSchemaLocation="C:\Users\e14user\Documents\LabVIEW software\GitRepo\lib\Config\validator.xsd"><Loop>
<Duration>10:00:00</Duration>
<Image>
<Prefix>bla.tif</Prefix>
<AcquisitionInterval>00:10:00</AcquisitionInterval>
<SaveDir>C:\Users\e14user\Documents\LabVIEW software\GitRepo\Config_Files\TestFolder</SaveDir>
</Image>
<Microscope>
<Objective>20</Objective>
<Filter>BF</Filter>
<Prism>Side</Prism>
<Intensity>10.0</Intensity>
<Exposure>50</Exposure>
</Microscope>
<Microscope>
<Objective>20</Objective>
<Filter>GFP</Filter>
<Prism>Side</Prism>
<Intensity>50.0</Intensity>
<Exposure>500</Exposure>
</Microscope>
<Position>
<X>610.8</X>
<Y>0.0</Y>
<Focus>434.86</Focus>
</Position>
<Position>
<X>2236.9</X>
<Y>-482.1</Y>
<Focus>434.86</Focus>
</Position>
<Position>
<X>2236.9</X>
<Y>682.3</Y>
<Focus>434.86</Focus>
</Position>
<Program>
<IterationStart>
<ID>0</ID>
<Iterations>100</Iterations>
</IterationStart>
<ChangeReagent>
<Duration>00:00:10</Duration>
<ReagentNr>3</ReagentNr>
</ChangeReagent>
<Feed>
<Ratio>25</Ratio>
</Feed>
<ChangeReagent>
<Duration>00:00:10</Duration>
<ReagentNr>2</ReagentNr>
</ChangeReagent>
<Feed>
<Ratio>5</Ratio>
</Feed>
<Pump>
<Duration>00:05:00</Duration>
<Frequency>10</Frequency>
</Pump>
<Acquire />
<IterationEnd>0</IterationEnd>
</Program>
</Loop>
</Measurement>