<?xml version="1.0" encoding="UTF-8" standalone="no" ?>
<Measurement xmlns:xsi="http://www.w3.org/2001/XMLSchema-instance" xsi:noNamespaceSchemaLocation="C:\Users\e14user\Documents\LabVIEW software\GitRepo\lib\Config\validator.xsd"><Loop>
<Duration>00:10:00</Duration>
<Image>
<Prefix>img</Prefix>
<AcquisitionInterval>00:01:00</AcquisitionInterval>
<SaveDir>C:\Users\e14user\Documents\LabVIEW software\GitRepo\Config_Files</SaveDir>
</Image>
<Microscope>
<Objective>20</Objective>
<Filter>BF</Filter>
<Prism>Camera</Prism>
<Intensity>9.5</Intensity>
<Exposure>50</Exposure>
</Microscope>
<Microscope>
<Objective>20</Objective>
<Filter>GFP</Filter>
<Prism>Camera</Prism>
<Intensity>2.5</Intensity>
<Exposure>150</Exposure>
</Microscope>
<Position>
<X>60415.1</X>
<Y>40337.1</Y>
<Focus>419.78</Focus>
</Position>
<Position>
<X>57455.3</X>
<Y>43292.3</Y>
<Focus>419.78</Focus>
</Position>
<Position>
<X>57455.3</X>
<Y>43292.3</Y>
<Focus>408.78</Focus>
</Position>
<Program>
<Pump>
<Duration>00:00:10</Duration>
<Frequency>8</Frequency>
</Pump>
<Pump>
<Duration>00:00:10</Duration>
<Frequency>12</Frequency>
</Pump>
<Feed>
<Ratio>10</Ratio>
</Feed>
<IterationStart>
<ID>0</ID>
<Iterations>3</Iterations>
</IterationStart>
<Pump>
<Duration>00:00:12</Duration>
<Frequency>8</Frequency>
</Pump>
<Incubate>00:00:10</Incubate>
<Acquire />
<IterationEnd>0</IterationEnd>
</Program>
</Loop>
</Measurement>