<?xml version="1.0" encoding="UTF-8" standalone="no" ?>
<Measurement xmlns:xsi="http://www.w3.org/2001/XMLSchema-instance" xsi:noNamespaceSchemaLocation="C:\Users\e14user\Documents\LabVIEW software\GitRepo\lib\Config\validator.xsd"><Loop>
<Duration>01:00:00</Duration>
<Image>
<Prefix>img</Prefix>
<AcquisitionInterval>00:01:00</AcquisitionInterval>
<SaveDir>C:\Users\e14user\Documents\LabVIEW software\GitRepo\Config_Files</SaveDir>
</Image>
<Microscope>
<Objective>Objective</Objective>
<Filter>20</Filter>
<Prism>Filter</Prism>
<Intensity>BF</Intensity>
<Exposure>Prism</Exposure>
</Microscope>
<Microscope>
<Objective>Objective</Objective>
<Filter>20</Filter>
<Prism>Filter</Prism>
<Intensity>GFP</Intensity>
<Exposure>Prism</Exposure>
</Microscope>
<Position>
<X>-527.4</X>
<Y>-44.0</Y>
<Focus>435.33</Focus>
</Position>
<Position>
<X>-927.4</X>
<Y>-44.0</Y>
<Focus>435.33</Focus>
</Position>
<Position>
<X>-1327.4</X>
<Y>-44.0</Y>
<Focus>435.33</Focus>
</Position>
<Position>
<X>-1327.4</X>
<Y>756.0</Y>
<Focus>435.33</Focus>
</Position>
<Position>
<X>-2727.4</X>
<Y>456.0</Y>
<Focus>439.58</Focus>
</Position>
<Position>
<X>-2727.4</X>
<Y>456.0</Y>
<Focus>433.24</Focus>
</Position>
<Program>
<Pump>
<Duration>00:00:05</Duration>
<Frequency>8</Frequency>
</Pump>
<Pump>
<Duration>00:00:05</Duration>
<Frequency>12</Frequency>
</Pump>
<Feed>
<Ratio>10</Ratio>
</Feed>
<IterationStart>
<ID>0</ID>
<Iterations>3</Iterations>
</IterationStart>
<Pump>
<Duration>00:00:12</Duration>
<Frequency>10</Frequency>
</Pump>
<Feed>
<Ratio>3</Ratio>
</Feed>
<Incubate>00:00:10</Incubate>
<Acquire />
<IterationEnd>0</IterationEnd>
</Program>
</Loop>
</Measurement>