<?xml version="1.0" encoding="UTF-8" standalone="no" ?>
<Measurement xmlns:xsi="http://www.w3.org/2001/XMLSchema-instance" xsi:noNamespaceSchemaLocation="C:\Users\e14user\Documents\LabVIEW software\GitRepo\config\validator.xsd">
	<Configuration>
		<Microscope>
			<Objective>4</Objective>
			<Filter>BF</Filter>
			<Prism>Ocular</Prism>
			<Intensity>0.0</Intensity>
			<Exposure>50</Exposure>
		</Microscope>
	</Configuration>
	<Loop>
		<Duration>00:12:00</Duration>
		<Image>
			<Prefix>testIMG</Prefix>
			<AcquisitionInterval>00:04:00</AcquisitionInterval>
			<SaveDir>./TestImages/</SaveDir>
		</Image>
		<Microscope>
			<Objective>20</Objective>
			<Filter>BF</Filter>
			<Prism>Camera</Prism>
			<Intensity>9.5</Intensity>
			<Exposure>50</Exposure>
		</Microscope>
		<Microscope>
			<Objective>20</Objective>
			<Filter>GFP</Filter>
			<Prism>Camera</Prism>
			<Intensity>2.5</Intensity>
			<Exposure>150</Exposure>
		</Microscope>
		<Position>
			<X>60415.1</X>
			<Y>40337.1</Y>
			<Focus>419.78</Focus>
		</Position>
		<Position>
			<X>57455.3</X>
			<Y>43292.3</Y>
			<Focus>419.78</Focus>
		</Position>
		<Position>
			<X>57455.3</X>
			<Y>43292.3</Y>
			<Focus>408.78</Focus>
		</Position>
		<Program>
			<Pump>
				<Duration>00:00:10.0000</Duration>
				<Frequency>7</Frequency>
			</Pump>
			<Pump>
				<Duration>00:00:20.0000</Duration>
				<Frequency>5</Frequency>
			</Pump>
		</Program>
	</Loop>
</Measurement> 