<?xml version="1.0" encoding="UTF-8" standalone="no" ?>
<Measurement xmlns:xsi="http://www.w3.org/2001/XMLSchema-instance" xsi:noNamespaceSchemaLocation="C:\Users\e14user\Documents\LabVIEW software\GitRepo\lib\Config\validator.xsd"><Loop>
<Duration>05:00:00</Duration>
<Image>
<Prefix>DilSeries</Prefix>
<AcquisitionInterval>00:00:01</AcquisitionInterval>
<SaveDir>C:\Users\e14user\Documents\LabVIEW software\GitRepo\Test_N_Eval_Images\200303_DilsSeries</SaveDir>
</Image>
<Microscope>
<Objective>10</Objective>
<Filter>BF</Filter>
<Prism>Side</Prism>
<Intensity>25.0</Intensity>
<Exposure>50</Exposure>
</Microscope>
<Microscope>
<Objective>10</Objective>
<Filter>GFP</Filter>
<Prism>Side</Prism>
<Intensity>20.0</Intensity>
<Exposure>50</Exposure>
</Microscope>
<Position>
<X>-89.800</X>
<Y>-645.700</Y>
<Focus>426.90</Focus>
</Position>
<Position>
<X>-89.800</X>
<Y>-2567.100</Y>
<Focus>421.65</Focus>
</Position>
<Position>
<X>-89.800</X>
<Y>-4436.100</Y>
<Focus>421.65</Focus>
</Position>
<Position>
<X>-89.800</X>
<Y>-6295.200</Y>
<Focus>421.65</Focus>
</Position>
<Position>
<X>-89.800</X>
<Y>-8225.100</Y>
<Focus>421.65</Focus>
</Position>
<Position>
<X>120.800</X>
<Y>-10210.400</Y>
<Focus>421.65</Focus>
</Position>
<Position>
<X>120.800</X>
<Y>-12060.400</Y>
<Focus>421.65</Focus>
</Position>
<Position>
<X>120.800</X>
<Y>-13949.900</Y>
<Focus>421.65</Focus>
</Position>
<Program>
<IterationStart>
<ID>0</ID>
<Iterations>10</Iterations>
</IterationStart>
<IterationStart>
<ID>1</ID>
<Iterations>30</Iterations>
</IterationStart>
<ChangeReagent>
<Duration>00:00:05</Duration>
<ReagentNr>1</ReagentNr>
</ChangeReagent>
<Feed>
<Ratio>10</Ratio>
<Ring>2</Ring>
</Feed>
<Feed>
<Ratio>20</Ratio>
<Ring>3</Ring>
</Feed>
<Feed>
<Ratio>30</Ratio>
<Ring>4</Ring>
</Feed>
<Feed>
<Ratio>40</Ratio>
<Ring>5</Ring>
</Feed>
<Feed>
<Ratio>50</Ratio>
<Ring>6</Ring>
</Feed>
<Feed>
<Ratio>60</Ratio>
<Ring>7</Ring>
</Feed>
<Feed>
<Ratio>70</Ratio>
<Ring>8</Ring>
</Feed>
<Pump>00:04:10</Pump>
<Incubate>00:01:00</Incubate>
<Acquire />
<Incubate>00:01:00</Incubate>
<IterationEnd>1</IterationEnd>
<ChangeReagent>
<Duration>00:00:10</Duration>
<ReagentNr>2</ReagentNr>
</ChangeReagent>
<Feed>
<Ratio>100</Ratio>
<Ring>2</Ring>
</Feed>
<Feed>
<Ratio>100</Ratio>
<Ring>3</Ring>
</Feed>
<Feed>
<Ratio>100</Ratio>
<Ring>4</Ring>
</Feed>
<Feed>
<Ratio>100</Ratio>
<Ring>5</Ring>
</Feed>
<Feed>
<Ratio>100</Ratio>
<Ring>6</Ring>
</Feed>
<Feed>
<Ratio>100</Ratio>
<Ring>7</Ring>
</Feed>
<Feed>
<Ratio>100</Ratio>
<Ring>8</Ring>
</Feed>
<Pump>00:02:00</Pump>
<IterationEnd>0</IterationEnd>
</Program>
</Loop>
</Measurement>