<?xml version="1.0" encoding="UTF-8" standalone="no"?>
<Measurement xmlns:xsi="http://www.w3.org/2001/XMLSchema-instance" xsi:noNamespaceSchemaLocation="C:\Users\johan\Downloads\LabVIEW software\LabVIEW software\IX-81 Software\lib\Config\validator.xsd">
	<Configuration>
		<Microscope>
			<Objective>4</Objective>
			<Filter>BF</Filter>
			<Prism>Ocular</Prism>
			<Intensity>0.0</Intensity>
			<Exposure>50</Exposure>
		</Microscope>
	</Configuration>
	<Loop>
		<Duration>00:12:00</Duration>
		<Image>
			<Prefix>testIMG</Prefix>
			<AcquisitionInterval>00:04:00</AcquisitionInterval>
			<SaveDir>./TestImages/</SaveDir>
		</Image>
		<Microscope>
			<Objective>20</Objective>
			<Filter>BF</Filter>
			<Prism>Camera</Prism>
			<Intensity>9.5</Intensity>
			<Exposure>50</Exposure>
		</Microscope>
		<Microscope>
			<Objective>20</Objective>
			<Filter>GFP</Filter>
			<Prism>Camera</Prism>
			<Intensity>2.5</Intensity>
			<Exposure>150</Exposure>
		</Microscope>
		<Position>
			<X>60415.1</X>
			<Y>40337.1</Y>
			<Focus>419.78</Focus>
		</Position>
		<Position>
			<X>57455.3</X>
			<Y>43292.3</Y>
			<Focus>419.78</Focus>
		</Position>
		<Position>
			<X>57455.3</X>
			<Y>43292.3</Y>
			<Focus>408.78</Focus>
		</Position>
		<Program>
			<Feed>
				<Ratio>33</Ratio>
			</Feed>
			<ChangeReagent>
				<Duration>00:00:05</Duration>
				<ReagentNr>3</ReagentNr>
			</ChangeReagent>
			<Pump>
				<Duration>00:00:10</Duration>
				<Frequency>7</Frequency>
			</Pump>
			<IterationStart>
				<ID>1</ID>
				<Iterations>4</Iterations>
			</IterationStart>
			<IterationStart>
				<ID>2</ID>
				<Iterations>2</Iterations>
			</IterationStart>
			<Feed>
				<Ratio>25</Ratio>
			</Feed>
			<Pump>
				<Duration>00:00:20</Duration>
				<Frequency>5</Frequency>
			</Pump>
			<IterationEnd>2</IterationEnd>

			<Incubate>00:05:00</Incubate>
			<IterationEnd>1</IterationEnd>
		</Program>
	</Loop>
</Measurement>
